{
  "$schema": "https://json-schema.org/draft/2020-12/schema",
  "$id": "https://paneforge.local/method-layer/adapter/v0.1/recovery-envelope.internal.schema.json",
  "title": "PaneForge Method Layer Launch Recovery Envelope",
  "type": "object",
  "required": [
    "schemaVersion",
    "envelopeType",
    "operation",
    "attemptState",
    "recoveryAction"
  ],
  "properties": {
    "schemaVersion": {
      "const": "0.1-internal"
    },
    "envelopeType": {
      "const": "recovery-envelope"
    },
    "operation": {
      "const": "recover-launch"
    },
    "attemptState": {
      "type": "string",
      "enum": [
        "prepared",
        "launched",
        "bound",
        "conflict",
        "failed"
      ]
    },
    "recoveryAction": {
      "type": "string",
      "enum": [
        "retry-launch",
        "bind-response",
        "repair-metadata",
        "already-bound",
        "manual-review"
      ]
    },
    "taskId": {
      "$ref": "#/$defs/taskId"
    },
    "runId": {
      "$ref": "#/$defs/runId"
    },
    "runPath": {
      "$ref": "#/$defs/relativePath"
    },
    "launchTaskId": {
      "type": "string",
      "minLength": 1
    },
    "sessionId": {
      "type": "string",
      "minLength": 1
    },
    "taskBindingPatch": {
      "$ref": "#/$defs/methodMetadataPatch"
    },
    "bindResult": {
      "$ref": "#/$defs/bindEnvelope"
    }
  },
  "allOf": [
    {
      "if": {
        "properties": {
          "recoveryAction": {
            "const": "bind-response"
          }
        },
        "required": [
          "recoveryAction"
        ]
      },
      "then": {
        "required": [
          "bindResult"
        ]
      }
    },
    {
      "if": {
        "properties": {
          "recoveryAction": {
            "const": "repair-metadata"
          }
        },
        "required": [
          "recoveryAction"
        ]
      },
      "then": {
        "required": [
          "taskId",
          "runId",
          "runPath",
          "sessionId",
          "taskBindingPatch"
        ]
      }
    },
    {
      "if": {
        "properties": {
          "recoveryAction": {
            "enum": [
              "retry-launch",
              "repair-metadata",
              "already-bound",
              "manual-review"
            ]
          }
        },
        "required": [
          "recoveryAction"
        ]
      },
      "then": {
        "required": [
          "taskId",
          "runId"
        ]
      }
    }
  ],
  "additionalProperties": false,
  "$defs": {
    "relativePath": {
      "type": "string",
      "minLength": 1,
      "pattern": "^(?![A-Za-z]:[\\\\/])(?![\\\\/]{2})(?![\\\\/]).+"
    },
    "sha256": {
      "type": "string",
      "pattern": "^[0-9A-Fa-f]{64}$"
    },
    "taskId": {
      "type": "string",
      "minLength": 3,
      "maxLength": 128,
      "pattern": "^[A-Za-z0-9][A-Za-z0-9._:-]{2,127}$"
    },
    "runId": {
      "type": "string",
      "pattern": "^run-[A-Za-z0-9][A-Za-z0-9._:-]{1,123}$"
    },
    "taskBindingLookup": {
      "type": "object",
      "required": [
        "operation",
        "sessionId",
        "fallback"
      ],
      "properties": {
        "operation": {
          "const": "find_task_binding_by_session"
        },
        "sessionId": {
          "type": "string",
          "minLength": 1
        },
        "fallback": {
          "const": "create_or_register_task_binding"
        }
      },
      "additionalProperties": false
    },
    "methodMetadataPatch": {
      "type": "object",
      "required": [
        "metadata"
      ],
      "properties": {
        "metadata": {
          "type": "object",
          "required": [
            "methodLayer"
          ],
          "properties": {
            "methodLayer": {
              "type": "object",
              "required": [
                "protocolVersion",
                "taskId",
                "runId",
                "artifactRoot",
                "taskPath",
                "runPath"
              ],
              "properties": {
                "protocolVersion": {
                  "const": "0.1"
                },
                "taskId": {
                  "$ref": "#/$defs/taskId"
                },
                "runId": {
                  "$ref": "#/$defs/runId"
                },
                "artifactRoot": {
                  "$ref": "#/$defs/relativePath"
                },
                "taskPath": {
                  "$ref": "#/$defs/relativePath"
                },
                "runPath": {
                  "$ref": "#/$defs/relativePath"
                },
                "latestEvidencePath": {
                  "$ref": "#/$defs/relativePath"
                },
                "latestHandoffPath": {
                  "$ref": "#/$defs/relativePath"
                }
              },
              "additionalProperties": false
            }
          },
          "additionalProperties": false
        }
      },
      "additionalProperties": false
    },
    "bindEnvelope": {
      "type": "object",
      "required": [
        "schemaVersion",
        "envelopeType",
        "operation",
        "runPath",
        "runSha256",
        "launchTaskId",
        "sessionId",
        "taskBindingLookup",
        "taskBindingPatch",
        "idempotent"
      ],
      "properties": {
        "schemaVersion": {
          "const": "0.1-internal"
        },
        "envelopeType": {
          "const": "bind-launch-envelope"
        },
        "operation": {
          "const": "bind-launch"
        },
        "attemptPath": {
          "$ref": "#/$defs/relativePath"
        },
        "attemptSha256": {
          "$ref": "#/$defs/sha256"
        },
        "runPath": {
          "$ref": "#/$defs/relativePath"
        },
        "runSha256": {
          "$ref": "#/$defs/sha256"
        },
        "launchTaskId": {
          "type": "string",
          "minLength": 1
        },
        "sessionId": {
          "type": "string",
          "minLength": 1
        },
        "taskBindingLookup": {
          "$ref": "#/$defs/taskBindingLookup"
        },
        "taskBindingPatch": {
          "$ref": "#/$defs/methodMetadataPatch"
        },
        "idempotent": {
          "type": "boolean"
        }
      },
      "dependentRequired": {
        "attemptPath": [
          "attemptSha256"
        ],
        "attemptSha256": [
          "attemptPath"
        ]
      },
      "additionalProperties": false
    }
  }
}
