{
  "schemaVersion": "0.1-internal",
  "envelopeType": "recovery-envelope",
  "operation": "recover-launch",
  "attemptState": "bound",
  "recoveryAction": "repair-metadata",
  "taskId": "team:task-001",
  "runId": "run-controller-fixture",
  "runPath": ".paneforge-method/v0.1/tasks/team%3Atask-001/runs/run-controller-fixture/run.json",
  "launchTaskId": "launch-task-controller-fixture",
  "sessionId": "session-controller-fixture",
  "taskBindingPatch": {
    "metadata": {
      "methodLayer": {
        "protocolVersion": "0.1",
        "taskId": "team:task-001",
        "runId": "run-controller-fixture",
        "artifactRoot": ".paneforge-method/v0.1",
        "taskPath": ".paneforge-method/v0.1/tasks/team%3Atask-001/task.json",
        "runPath": ".paneforge-method/v0.1/tasks/team%3Atask-001/runs/run-controller-fixture/run.json"
      }
    }
  }
}
